{
  "run_id": "cu_grid-localsgd-30m-h32-bw5g-r0",
  "spec": {
    "spec_id": "cu_grid-localsgd-30m-h32-bw5g-r0",
    "phase": "cu_grid",
    "algorithm": "localsgd",
    "implementation": "reference",
    "H": 32,
    "model_config": "30m-realvocab",
    "world_size": 4,
    "bandwidth_requested_bps": 5000000000,
    "micro_batch_size": 4,
    "seq_len": 512,
    "grad_accum": 1,
    "budget_type": "steps",
    "budget_value": 150,
    "warmup_steps": 10,
    "compression": null,
    "seed": 42,
    "repeat_index": 0,
    "fault_schedule": null
  },
  "fingerprint": {
    "harness_git_sha": "c6d8889d96850246778deb8efa724d73c569b964",
    "harness_dirty": false,
    "harness_version": "0.1.0",
    "pytorch_version": "2.13.0+cu130",
    "nccl_version": "2.29.7",
    "cuda_version": "13.0",
    "driver_version": "595.71.05",
    "instance_types": [
      "g6e.2xlarge"
    ],
    "az": "us-east-1b",
    "placement_group_id": "pg-0f8e8774a16b3b7e7",
    "gpu_clocks_locked": true,
    "nccl_env": {
      "NCCL_SOCKET_IFNAME": "enp39s0"
    },
    "kernel_version": "6.17.0-1019-aws",
    "dataset_shard_checksum": "e1a2eea5c5c8b7a0c0d17c760a8eacf0be6861828332efb6218919b9e70a141e",
    "seed": 42,
    "torchtitan_version": "0.2.2"
  },
  "shaping": {
    "requested_bps": 5000000000,
    "measured_bps": 4963578657.935014,
    "error_pct": 0.7284268412997246,
    "tolerance_pct": 10.0,
    "passed": true,
    "attempts": 1,
    "iperf_raw": "",
    "qdisc_dump": ""
  },
  "network_profile_id": "phase1-us-east-1b-20260814",
  "harness_version": "0.1.0",
  "status": "completed",
  "started_at": "2026-08-16T20:34:38.502339+00:00",
  "ended_at": "2026-08-16T20:34:46.439669+00:00",
  "cu": {
    "cu_measured": 0.6256809752624525,
    "cu_analytic_link": 0.7984337966013167,
    "cu_analytic_achieved": 0.6063022803640069,
    "nccl_bw_used_bps": 1929745402,
    "nccl_bw_interpolated": false,
    "discrepancy_link": 1.276103682497938,
    "discrepancy_achieved": 0.9690278342084528,
    "compute_s": 3.4463812160491942,
    "sync_blocked_s": 2.0460627369415016,
    "optimizer_s": 0.0018524159993976354,
    "loader_stall_s": 0.012279775984585285,
    "total_s": 5.5082084197998045
  },
  "throughput": {
    "tokens_per_s": 208212.89112398608,
    "step_time_p50_ms": 24.70694351196289,
    "step_time_p90_ms": 24.933727264404297,
    "step_time_p99_ms": 376.2607116699219
  },
  "faults": [],
  "loader_bound_warning": false,
  "notes": "Real LocalSGD training, 2026-08-16 grid (see CLAUDE.md ADR for this campaign). No-outer-optimizer ablation against DiLoCo -- parameter averaging every H steps (LocalSGDTrainer, measurement/localsgd.py), no pseudo-gradient/Nesterov outer step. sync_blocked_ms is a DIRECT StepTimer measurement (explicit outer all-reduce), not imputed. Bandwidth level '5g' requested=5000000000bps measured=4963578658bps (FR-02 gate passed, error=0.73%)."
}