{
  "run_id": "cu_grid-diloco-30m-h32-bwunshaped-r0",
  "spec": {
    "spec_id": "cu_grid-diloco-30m-h32-bwunshaped-r0",
    "phase": "cu_grid",
    "algorithm": "diloco",
    "implementation": "reference",
    "H": 32,
    "model_config": "30m-realvocab",
    "world_size": 4,
    "bandwidth_requested_bps": null,
    "micro_batch_size": 4,
    "seq_len": 512,
    "grad_accum": 1,
    "budget_type": "steps",
    "budget_value": 150,
    "warmup_steps": 20,
    "compression": null,
    "seed": 42,
    "repeat_index": 0,
    "fault_schedule": null
  },
  "fingerprint": {
    "harness_git_sha": "bfd808ec075e8595b97076ec21526970a32efaf3",
    "harness_dirty": true,
    "harness_version": "0.1.0",
    "pytorch_version": "2.13.0+cu130",
    "nccl_version": "2.29.7",
    "cuda_version": "13.0",
    "driver_version": "595.71.05",
    "instance_types": [
      "g6e.2xlarge"
    ],
    "az": "us-east-1b",
    "placement_group_id": "pg-04ac04963de1615d8",
    "gpu_clocks_locked": true,
    "nccl_env": {
      "NCCL_SOCKET_IFNAME": "enp39s0"
    },
    "kernel_version": "6.17.0-1019-aws",
    "dataset_shard_checksum": "a7b9db02a2f15e720016ec1ccc9c1ed300ace2a3680471c8e86c53f40143a90c",
    "seed": 42,
    "torchtitan_version": "0.2.2"
  },
  "shaping": null,
  "network_profile_id": "phase1-us-east-1b-20260814",
  "harness_version": "0.1.0",
  "status": "completed",
  "started_at": "2026-08-14T16:57:10.945119+00:00",
  "ended_at": "2026-08-14T16:57:18.064834+00:00",
  "cu": {
    "cu_measured": 0.7100794142796818,
    "cu_analytic_link": 0.882743318390873,
    "cu_analytic_achieved": 0.921748014255865,
    "nccl_bw_used_bps": 14911310120,
    "nccl_bw_interpolated": true,
    "discrepancy_link": 1.2431613994701491,
    "discrepancy_achieved": 1.298091446843173,
    "compute_s": 3.1677681255340575,
    "sync_blocked_s": 1.2794847406651824,
    "optimizer_s": 0.0016959999976679683,
    "loader_stall_s": 0.0108143679946661,
    "total_s": 4.461146263122559
  },
  "throughput": {
    "tokens_per_s": 238718.9159887769,
    "step_time_p50_ms": 24.43654441833496,
    "step_time_p90_ms": 24.752351760864258,
    "step_time_p99_ms": 188.40797424316406
  },
  "faults": [],
  "loader_bound_warning": false,
  "notes": "First real training runs, 2026-08-14. Model: torchtitan debugmodel dims (dim=256,n_layers=6,n_heads=16) with vocab_size overridden to 50257 (gpt2) -- 30846720 real params. Data: real FineWeb-Edu (sample-10BT), gpt2-tokenized, one disjoint shard per rank. Reference DiLoCoTrainer (measurement/diloco.py), NOT torchft's DiLoCo path (US-06 equivalence test still not run -- see ADR-032). Unshaped baseline (no tc shaping applied). Run via train_driver.py directly (torchrun), not through measurement/train.py::run()'s full orchestration -- see ADR-034 for exactly what that means and doesn't mean."
}